{"assurance":"operator_asserted_pre_outcome_binding_not_independent_or_timestamped","evaluator":{"case_count":448,"ciphertext_link_status":"in_process_openssl_decryption_then_inner_signature_verification","class_counts":{"adversarial":112,"benign":336},"encryption_profile":"openssl-aes-256-cbc-pbkdf2-sha256/v1","label_ledger_digest":"sha256:f4d6f0c3fd6f968f80f2231aa24c6c4e77c1851ab81255f601f07e79b957c184","label_ledger_digest_rule":"raw_sha256_of_signature_verified_canonical_jsonl_bytes","label_ledger_signature_status":"verified","manifest_digest":"sha256:053ad2307496cf2121c92f5e1258500597bf39e22e8340aebc7e8db814f83230","manifest_signature_status":"verified","openssl_executable_digest":"sha256:517827f877751b6d7abebe404a296fa8e82425c63694a73ab06db35e6d9a8362","passphrase_transport":"bounded_stdin_not_argv_or_environment","pbkdf2_iterations":600000,"public_manifest_digest":"sha256:c20a33dcbfb3ff07bcdd35ea1652c4cc400e1ef64037a4c607111de51f622b4b"},"limitations":{"authorship":"technical_codex_authorship_not_independent_human_identity","custody":"software_signatures_operator_uid_trusted_not_same_uid_or_hardware_attested","novelty":"deterministic_lexical_novelty_not_independent_semantic_review","ordering":"signed_authoring_contract_source_freeze_chain_verified_before_dispatch"},"lock":{"canonical_json":true,"lock_digest":"sha256:d96bdbfdd1a8884cbc4dd0293ade0f04708f42627f7f336fb744661b8adbc0c6","semantic_preflight":"passed"},"pre_outcome":{"dispatch_material_observed":false,"evidence_status":"operator_observed_paths_absent_not_timestamp_attested","labels_exposed_to_worker":false,"outcomes_observed":false,"paths_checked_absent":4,"state_binding_digest":"sha256:0de77709907f1ee4aa332802e4da588c5e3a39e90908c7d5a7d43bf677d9a28f","state_layout":"phase0-hidden-run-state/v1"},"recorded_on":"2026-07-26","release":{"authoring_contract":{"commit":"b6e83389076bccd952ceb715f2cb634cbd71313d","path":"AUTHORING-CONTRACT.json","sha256":"3a5866a2c44baffb2a71ee76d1b0e0fc983ad46ed77eb95d52bd34738bf231c4","signature_status":"verified"},"authorship":{"authoring_context":"fresh_context_subagent_with_instruction_boundary_not_os_sandboxed","authoring_input_provenance_retained":true,"candidate_detector_source_provided_to_author":false,"independent_human_authorship":false,"mode":"technical-codex-semantic-corpus-authoring","operator_case_or_label_authorship":false,"outcomes_used_for_tuning":false,"prior_corpus_bodies_provided_to_author":false,"prior_outcomes_provided_to_author":false,"v5_scanner_evaluations_before_freeze":0},"evaluator_ciphertext_digest":"sha256:d5e6574c5c6b8ad6b5a2dcf7fd474d9c3304781ff14efea42041d0d8a7db8ac7","fingerprint":"SHA256:HJb87ljuOOkonZk+6GzgpASjhRMkRKBHKO3bzjuIDNk","freeze_commit":"4ce03a84701d596e6cfda436d89cd7844ca437fa","freeze_tag":"local-v5.0.0","freeze_tag_object":"1d80d4eb93cdaaaa9f0f554f400b57b22355b4e5","novelty":{"candidate_unique_body_count":448,"claim":"new-corpus-with-bounded-lexical-novelty-not-semantic-independence","exact_reference_body_overlap_count":0,"maximum_allowed_similarity":{"denominator":2,"numerator":1},"maximum_exact_reference_body_overlap_count":0,"maximum_observed_similarity":{"candidate_case_id":"v5-005b117813a6fe8ac8cae00e","denominator":142,"numerator":0,"reference_case_id":"v4-0009875054bb4eb3f0327626"},"method":"skill-body-nfkc-casefold-alnum-token-5gram-jaccard/v1","reference_corpus_id":"local-v4.0.0","reference_corpus_lock_digest":"sha256:20342abfbd3619ee3c3819bb538fc4d25cec54e6b9bbd537e3dca58ffcf73dac","reference_worker_archive_digest":"sha256:d702666946f19ab4654c5c29c8f5a6d161418010dc9266ab7df1bb4e9324552e","required_unique_candidate_body_count":448,"unicode_version":"15.0.0","verification_status":"passed"},"principal":"aragorn-local-v5-author","release_manifest_digest":"sha256:be9f50ad5d47c9ada8100ef2dc008d36b57d349e5fe288aa33cd00c57af9bb6a","signature_status":"verified","source_bundle_digest":"sha256:146a47933a6c6fd80ed604c925cd2727180b00b95dd08ae372cd23044f23073a","worker_archive_digest":"sha256:e14b49f0f5dcce0814e853143410cd60f4a74780fc3140672823546018d73205"},"schema":"aragorn/benchmark-phase0-hidden-suite-freeze-receipt/v5","suite":{"candidate_policy_digest":"sha256:59120d59856c30fd803421cd5960f5c9a779f62c7903ee52731d9c4027749aa9","case_count":448,"class_counts":{"adversarial":112,"benign":336},"private_suite_retained_outside_repository":true,"runs_per_case":1,"split":"hidden","suite_digest":"sha256:2d00bf1e1572d1b7871fab301903e9f695023f125fcaea8e22f537400f9616b7","systems":[{"config_digest":"sha256:59120d59856c30fd803421cd5960f5c9a779f62c7903ee52731d9c4027749aa9","implementation_digest":"sha256:72ffcb392d60415d70a9aa53e18fc3856fd7e45c0d7d3db595bf5adda89de15d","name":"aragorn","version":"0.1.0-phase0"},{"config_digest":"sha256:0471e144da9f709a1596d0daa15c6faf85c6358d12840dadb652a1e45369085a","implementation_digest":"sha256:7fadcfbe836eef9490feba0fadd2ada564c11eb541077e3efee5f61edbd2e65c","name":"cisco-skill-scanner","version":"2.0.12"},{"config_digest":"sha256:2de741d4af73b3047ec0307795f7ceeb0f39e25837a5a8a7c97fa23992de7207","implementation_digest":"sha256:e731be01105243f94437a4b9bd449bd46bbcb5cb306f44b4845121d109a4a95e","name":"skillspector","version":"2.4.3+git.a54947c"}]}}